{
  "$schema": "https://json-schema.org/draft/2020-12/schema",
  "$id": "part.schema.json",
  "type": "object",
  "additionalProperties": false,
  "required": [
    "schema_version",
    "id",
    "display_name",
    "part_type",
    "interface_id",
    "spin_direction",
    "dimensions",
    "geometry",
    "mounts",
    "material_slots",
    "originality_rules",
    "engineering_status",
    "generation"
  ],
  "properties": {
    "schema_version": { "const": "1.0" },
    "id": { "type": "string", "pattern": "^[a-z][a-z0-9_]*$" },
    "display_name": { "type": "string", "minLength": 1, "maxLength": 80 },
    "part_type": {
      "enum": ["emblem_core", "main_blade", "assist_ring", "height_gear", "performance_tip"]
    },
    "interface_id": { "type": "string", "pattern": "^[A-Z][A-Z0-9-]*$" },
    "spin_direction": { "enum": ["right", "left", "bidirectional"] },
    "profile_family": {
      "enum": [
        "storm_fang_upper",
        "iron_bastion_damper",
        "orbit_halo_streamline",
        "dual_comet_alternating",
        "void_falcon_split_arc",
        "heavy_continuous_mass_band",
        "guard_cushion_ring",
        "air_truss_windows",
        "medium_chevron_rib",
        "high_tower_buttress"
      ]
    },
    "dimensions": { "$ref": "#/$defs/dimensions" },
    "geometry": { "$ref": "#/$defs/geometry" },
    "mounts": { "$ref": "#/$defs/mounts" },
    "material_slots": {
      "type": "array",
      "minItems": 1,
      "maxItems": 6,
      "uniqueItems": true,
      "items": { "type": "string", "pattern": "^[a-z][a-z0-9_]*$" }
    },
    "originality_rules": { "$ref": "#/$defs/originality" },
    "engineering_status": { "$ref": "#/$defs/engineering" },
    "generation": { "$ref": "#/$defs/generation" }
  },
  "$defs": {
    "dimensions": {
      "type": "object",
      "additionalProperties": false,
      "required": ["outer_radius_mm", "height_mm"],
      "properties": {
        "outer_radius_mm": { "type": "number", "exclusiveMinimum": 0, "maximum": 50 },
        "inner_radius_mm": { "type": "number", "minimum": 0, "maximum": 45 },
        "height_mm": { "type": "number", "exclusiveMinimum": 0, "maximum": 30 }
      }
    },
    "geometry": {
      "type": "object",
      "additionalProperties": false,
      "required": ["kind", "segments"],
      "properties": {
        "kind": {
          "enum": ["radial_blade", "radial_core", "annular_ring", "radial_gear", "revolved_tip"]
        },
        "segments": { "type": "integer", "minimum": 3, "maximum": 256 },
        "blade_count": { "type": "integer", "minimum": 1, "maximum": 32 },
        "base_radius_mm": { "type": "number", "exclusiveMinimum": 0, "maximum": 50 },
        "outer_radius_mm": { "type": "number", "exclusiveMinimum": 0, "maximum": 50 },
        "inner_radius_mm": { "type": "number", "minimum": 0, "maximum": 45 },
        "height_mm": { "type": "number", "exclusiveMinimum": 0, "maximum": 30 },
        "blade_angle_deg": { "type": "number", "minimum": -80, "maximum": 80 },
        "sweep_deg": { "type": "number", "minimum": -80, "maximum": 80 },
        "upper_rise_mm": { "type": "number", "minimum": 0, "maximum": 10 },
        "roundness": { "type": "number", "minimum": 0, "maximum": 1 },
        "tooth_count": { "type": "integer", "minimum": 3, "maximum": 64 },
        "spoke_count": { "type": "integer", "minimum": 0, "maximum": 32 },
        "node_count": { "type": "integer", "minimum": 0, "maximum": 64 },
        "contact_profile": {
          "enum": ["upper", "rounded_damper", "low_drag", "alternating", "flat", "ball", "needle", "taper"]
        },
        "profile_points_mm": {
          "type": "array",
          "minItems": 2,
          "maxItems": 32,
          "items": {
            "type": "array",
            "minItems": 2,
            "maxItems": 2,
            "items": { "type": "number", "minimum": -30, "maximum": 50 }
          }
        },
        "phase_deg": { "type": "number", "minimum": -360, "maximum": 360 },
        "damper_count": { "type": "integer", "minimum": 3, "maximum": 16 },
        "radial_amplitude_mm": { "type": "number", "minimum": 0, "maximum": 5 },
        "damper_width_deg": { "type": "number", "exclusiveMinimum": 0, "maximum": 120 },
        "inner_weight_radius_mm": { "type": "number", "exclusiveMinimum": 0, "maximum": 45 },
        "inner_band_width_mm": { "type": "number", "exclusiveMinimum": 0, "maximum": 15 },
        "window_count": { "type": "integer", "minimum": 1, "maximum": 16 },
        "window_inner_radius_mm": { "type": "number", "exclusiveMinimum": 0, "maximum": 45 },
        "window_outer_radius_mm": { "type": "number", "exclusiveMinimum": 0, "maximum": 50 },
        "window_width_deg": { "type": "number", "exclusiveMinimum": 0, "maximum": 120 },
        "spoke_width_mm": { "type": "number", "exclusiveMinimum": 0, "maximum": 10 },
        "streamline_sweep_deg": { "type": "number", "minimum": -80, "maximum": 80 },
        "unit_count": { "type": "integer", "minimum": 2, "maximum": 12 },
        "attack_radius_mm": { "type": "number", "exclusiveMinimum": 0, "maximum": 50 },
        "damper_radius_mm": { "type": "number", "exclusiveMinimum": 0, "maximum": 50 },
        "attack_height_mm": { "type": "number", "exclusiveMinimum": 0, "maximum": 30 },
        "damper_height_mm": { "type": "number", "exclusiveMinimum": 0, "maximum": 30 },
        "inner_cap_height_mm": { "type": "number", "exclusiveMinimum": 0, "maximum": 30 },
        "attack_span_deg": { "type": "number", "exclusiveMinimum": 0, "maximum": 120 },
        "damper_span_deg": { "type": "number", "exclusiveMinimum": 0, "maximum": 120 },
        "transition_span_deg": { "type": "number", "exclusiveMinimum": 0, "maximum": 120 },
        "attack_slope_deg": { "type": "number", "minimum": -80, "maximum": 80 },
        "damper_arc_deg": { "type": "number", "exclusiveMinimum": 0, "maximum": 120 },
        "arc_count": { "type": "integer", "minimum": 2, "maximum": 16 },
        "arc_span_deg": { "type": "number", "exclusiveMinimum": 0, "maximum": 170 },
        "arc_width_mm": { "type": "number", "exclusiveMinimum": 0, "maximum": 12 },
        "phase_offset_deg": { "type": "number", "minimum": -180, "maximum": 180 },
        "shoulder_count": { "type": "integer", "minimum": 2, "maximum": 32 },
        "shoulder_amplitude_mm": { "type": "number", "minimum": 0, "maximum": 5 },
        "cushion_count": { "type": "integer", "minimum": 6, "maximum": 8 },
        "recess_radius_mm": { "type": "number", "exclusiveMinimum": 0, "maximum": 50 },
        "groove_width_deg": { "type": "number", "exclusiveMinimum": 0, "maximum": 30 },
        "corner_roundness": { "type": "number", "minimum": 0, "maximum": 1 },
        "inner_bearing_radius_mm": { "type": "number", "exclusiveMinimum": 0, "maximum": 45 },
        "band_inner_radius_mm": { "type": "number", "exclusiveMinimum": 0, "maximum": 45 },
        "inner_step_height_mm": { "type": "number", "exclusiveMinimum": 0, "maximum": 30 },
        "bridge_width_deg": { "type": "number", "exclusiveMinimum": 0, "maximum": 120 },
        "chevron_count": { "type": "integer", "minimum": 3, "maximum": 32 },
        "waist_radius_mm": { "type": "number", "exclusiveMinimum": 0, "maximum": 45 },
        "buttress_count": { "type": "integer", "minimum": 3, "maximum": 32 },
        "shoulder_z_mm": { "type": "number", "exclusiveMinimum": 0, "maximum": 15 },
        "waist_height_mm": { "type": "number", "exclusiveMinimum": 0, "maximum": 15 },
        "rib_depth_mm": { "type": "number", "exclusiveMinimum": 0, "maximum": 5 },
        "buttress_depth_mm": { "type": "number", "exclusiveMinimum": 0, "maximum": 5 },
        "contact_radius_mm": { "type": "number", "exclusiveMinimum": 0, "maximum": 10 }
      }
    },
    "mount": {
      "type": "object",
      "additionalProperties": false,
      "required": [
        "position_mm",
        "rotation_deg",
        "datum_radius_mm",
        "interface_role",
        "orientation_key_deg"
      ],
      "properties": {
        "position_mm": {
          "type": "array",
          "minItems": 3,
          "maxItems": 3,
          "items": { "type": "number", "minimum": -50, "maximum": 50 }
        },
        "rotation_deg": {
          "type": "array",
          "minItems": 3,
          "maxItems": 3,
          "items": { "type": "number", "minimum": -360, "maximum": 360 }
        },
        "datum_radius_mm": { "type": "number", "exclusiveMinimum": 0, "maximum": 50 },
        "interface_role": { "enum": ["male", "female", "terminal"] },
        "orientation_key_deg": { "type": "number", "minimum": -360, "maximum": 360 }
      }
    },
    "mounts": {
      "type": "object",
      "additionalProperties": false,
      "required": ["top", "bottom"],
      "properties": {
        "top": { "$ref": "#/$defs/mount" },
        "bottom": { "$ref": "#/$defs/mount" }
      }
    },
    "originality": {
      "type": "object",
      "additionalProperties": false,
      "required": [
        "no_existing_logo",
        "no_existing_name",
        "no_reference_outline_tracing",
        "no_existing_interface_copy",
        "minimum_primary_dimensions_changed"
      ],
      "properties": {
        "no_existing_logo": { "const": true },
        "no_existing_name": { "const": true },
        "no_reference_outline_tracing": { "const": true },
        "no_existing_interface_copy": { "const": true },
        "minimum_primary_dimensions_changed": { "type": "integer", "minimum": 3, "maximum": 8 }
      }
    },
    "engineering": {
      "type": "object",
      "additionalProperties": false,
      "required": ["status", "mass_properties_validated", "manufacturing_validated"],
      "properties": {
        "status": { "enum": ["concept_only", "prototype", "validated"] },
        "mass_properties_validated": { "type": "boolean" },
        "manufacturing_validated": { "type": "boolean" }
      }
    },
    "generation": {
      "type": "object",
      "additionalProperties": false,
      "required": ["seed", "generator_version"],
      "properties": {
        "seed": { "type": "integer", "minimum": 0, "maximum": 2147483647 },
        "generator_version": { "const": "0.1.0" }
      }
    }
  },
  "allOf": [
    {
      "if": { "properties": { "part_type": { "const": "main_blade" } } },
      "then": {
        "required": ["profile_family"],
        "properties": {
          "geometry": {
            "required": ["kind", "segments", "blade_count", "base_radius_mm", "outer_radius_mm", "height_mm", "contact_profile"],
            "properties": { "kind": { "const": "radial_blade" } }
          }
        }
      }
    },
    {
      "if": { "properties": { "profile_family": { "const": "iron_bastion_damper" } }, "required": ["profile_family"] },
      "then": {
        "properties": {
          "geometry": {
            "required": ["damper_count", "radial_amplitude_mm", "damper_width_deg", "inner_weight_radius_mm", "inner_band_width_mm"]
          }
        }
      }
    },
    {
      "if": { "properties": { "profile_family": { "const": "orbit_halo_streamline" } }, "required": ["profile_family"] },
      "then": {
        "properties": {
          "geometry": {
            "required": ["window_count", "window_inner_radius_mm", "window_outer_radius_mm", "window_width_deg", "spoke_count", "spoke_width_mm", "streamline_sweep_deg"]
          }
        }
      }
    },
    {
      "if": { "properties": { "profile_family": { "const": "dual_comet_alternating" } }, "required": ["profile_family"] },
      "then": {
        "properties": {
          "geometry": {
            "required": ["unit_count", "attack_radius_mm", "damper_radius_mm", "attack_height_mm", "damper_height_mm", "inner_cap_height_mm", "attack_span_deg", "damper_span_deg", "transition_span_deg"]
          }
        }
      }
    },
    {
      "if": { "properties": { "profile_family": { "const": "guard_cushion_ring" } }, "required": ["profile_family"] },
      "then": {
        "properties": {
          "geometry": {
            "required": ["cushion_count", "recess_radius_mm", "groove_width_deg", "corner_roundness", "inner_bearing_radius_mm"]
          }
        }
      }
    },
    {
      "if": { "properties": { "profile_family": { "const": "heavy_continuous_mass_band" } }, "required": ["profile_family"] },
      "then": {
        "properties": {
          "geometry": {
            "required": ["inner_bearing_radius_mm", "band_inner_radius_mm", "inner_step_height_mm"]
          }
        }
      }
    },
    {
      "if": { "properties": { "part_type": { "const": "emblem_core" } } },
      "then": { "properties": { "geometry": { "properties": { "kind": { "const": "radial_core" } } } } }
    },
    {
      "if": { "properties": { "part_type": { "const": "assist_ring" } } },
      "then": { "properties": { "geometry": { "properties": { "kind": { "const": "annular_ring" } } } } }
    },
    {
      "if": { "properties": { "part_type": { "const": "height_gear" } } },
      "then": { "properties": { "geometry": { "properties": { "kind": { "const": "radial_gear" } } } } }
    },
    {
      "if": { "properties": { "part_type": { "const": "performance_tip" } } },
      "then": { "properties": { "geometry": { "properties": { "kind": { "const": "revolved_tip" } } } } }
    }
  ]
}
