{
  "schema_version": "1.0",
  "id": "blade_storm_fang",
  "display_name": "Storm Fang",
  "part_type": "main_blade",
  "interface_id": "NSS-V1",
  "spin_direction": "right",
  "dimensions": {
    "outer_radius_mm": 36.0,
    "inner_radius_mm": 10.8,
    "height_mm": 4.8
  },
  "geometry": {
    "kind": "radial_blade",
    "segments": 72,
    "blade_count": 3,
    "base_radius_mm": 27.0,
    "outer_radius_mm": 36.0,
    "inner_radius_mm": 10.8,
    "height_mm": 4.8,
    "blade_angle_deg": 24.0,
    "sweep_deg": 16.0,
    "upper_rise_mm": 1.1,
    "spoke_count": 3,
    "contact_profile": "upper",
    "phase_deg": 0.0
  },
  "mounts": {
    "top": {
      "position_mm": [0.0, 0.0, 3.5],
      "rotation_deg": [0.0, 0.0, 0.0],
      "datum_radius_mm": 10.8,
      "interface_role": "female",
      "orientation_key_deg": 0.0
    },
    "bottom": {
      "position_mm": [0.0, 0.0, -2.4],
      "rotation_deg": [0.0, 0.0, 0.0],
      "datum_radius_mm": 10.8,
      "interface_role": "male",
      "orientation_key_deg": 0.0
    }
  },
  "material_slots": [
    "gunmetal",
    "cobalt_blue_translucent",
    "solar_amber"
  ],
  "originality_rules": {
    "no_existing_logo": true,
    "no_existing_name": true,
    "no_reference_outline_tracing": true,
    "no_existing_interface_copy": true,
    "minimum_primary_dimensions_changed": 3
  },
  "engineering_status": {
    "status": "concept_only",
    "mass_properties_validated": false,
    "manufacturing_validated": false
  },
  "generation": {
    "seed": 31024,
    "generator_version": "0.1.0"
  }
}
