{
  "schema_version": "1.0", "id": "tip_needle_stamina", "display_name": "Needle Stamina Tip",
  "part_type": "performance_tip", "interface_id": "NSS-V1", "spin_direction": "right",
  "dimensions": { "outer_radius_mm": 8.0, "height_mm": 9.0 },
  "geometry": {
    "kind": "revolved_tip", "segments": 64, "outer_radius_mm": 8.0, "height_mm": 9.0,
    "contact_profile": "needle", "contact_radius_mm": 0.6,
    "profile_points_mm": [[0.6, -8.46], [1.0, -8.1], [1.6, -6.8], [3.4, -5.2], [6.8, -2.6], [8.0, -1.2], [8.0, -0.65]]
  },
  "mounts": {
    "top": { "position_mm": [0.0, 0.0, 0.54], "rotation_deg": [0.0, 0.0, 0.0], "datum_radius_mm": 10.8, "interface_role": "female", "orientation_key_deg": 0.0 },
    "bottom": { "position_mm": [0.0, 0.0, -8.46], "rotation_deg": [0.0, 0.0, 0.0], "datum_radius_mm": 0.6, "interface_role": "terminal", "orientation_key_deg": 0.0 }
  },
  "material_slots": ["obsidian_polymer", "cobalt_blue_translucent"],
  "originality_rules": { "no_existing_logo": true, "no_existing_name": true, "no_reference_outline_tracing": true, "no_existing_interface_copy": true, "minimum_primary_dimensions_changed": 4 },
  "engineering_status": { "status": "concept_only", "mass_properties_validated": false, "manufacturing_validated": false },
  "generation": { "seed": 71552, "generator_version": "0.1.0" }
}
