{
  "schema_version": "1.0",
  "id": "blade_dual_comet",
  "display_name": "Dual Comet",
  "part_type": "main_blade",
  "interface_id": "NSS-V1",
  "spin_direction": "right",
  "profile_family": "dual_comet_alternating",
  "dimensions": {
    "outer_radius_mm": 36.0,
    "inner_radius_mm": 10.8,
    "height_mm": 5.0
  },
  "geometry": {
    "kind": "radial_blade",
    "segments": 96,
    "blade_count": 6,
    "base_radius_mm": 28.0,
    "outer_radius_mm": 36.0,
    "inner_radius_mm": 10.8,
    "height_mm": 5.0,
    "contact_profile": "alternating",
    "unit_count": 3,
    "attack_radius_mm": 36.0,
    "damper_radius_mm": 33.0,
    "attack_height_mm": 5.0,
    "damper_height_mm": 4.4,
    "attack_slope_deg": 24.0,
    "damper_arc_deg": 38.0,
    "phase_deg": 0.0
  },
  "mounts": {
    "top": {
      "position_mm": [0.0, 0.0, 3.6],
      "rotation_deg": [0.0, 0.0, 0.0],
      "datum_radius_mm": 10.8,
      "interface_role": "female",
      "orientation_key_deg": 0.0
    },
    "bottom": {
      "position_mm": [0.0, 0.0, -2.4],
      "rotation_deg": [0.0, 0.0, 0.0],
      "datum_radius_mm": 10.8,
      "interface_role": "male",
      "orientation_key_deg": 0.0
    }
  },
  "material_slots": ["gunmetal", "cobalt_blue_translucent", "solar_amber"],
  "originality_rules": {
    "no_existing_logo": true,
    "no_existing_name": true,
    "no_reference_outline_tracing": true,
    "no_existing_interface_copy": true,
    "minimum_primary_dimensions_changed": 3
  },
  "engineering_status": {
    "status": "concept_only",
    "mass_properties_validated": false,
    "manufacturing_validated": false
  },
  "generation": {
    "seed": 63019,
    "generator_version": "0.1.0"
  }
}
