{
  "schema_version": "1.0", "id": "gear_high", "display_name": "High Height Gear",
  "part_type": "height_gear", "interface_id": "NSS-V1", "spin_direction": "right",
  "profile_family": "high_tower_buttress",
  "dimensions": { "outer_radius_mm": 17.2, "inner_radius_mm": 10.8, "height_mm": 6.0 },
  "geometry": {
    "kind": "radial_gear", "segments": 72, "outer_radius_mm": 17.2,
    "inner_radius_mm": 10.8, "height_mm": 6.0, "buttress_count": 8,
    "shoulder_count": 2, "waist_radius_mm": 15.0, "roundness": 0.22, "phase_deg": 0.0
  },
  "mounts": {
    "top": { "position_mm": [0.0, 0.0, 3.0], "rotation_deg": [0.0, 0.0, 0.0], "datum_radius_mm": 10.8, "interface_role": "female", "orientation_key_deg": 0.0 },
    "bottom": { "position_mm": [0.0, 0.0, -3.0], "rotation_deg": [0.0, 0.0, 0.0], "datum_radius_mm": 10.8, "interface_role": "male", "orientation_key_deg": 0.0 }
  },
  "material_slots": ["gunmetal", "cobalt_blue_translucent"],
  "originality_rules": { "no_existing_logo": true, "no_existing_name": true, "no_reference_outline_tracing": true, "no_existing_interface_copy": true, "minimum_primary_dimensions_changed": 4 },
  "engineering_status": { "status": "concept_only", "mass_properties_validated": false, "manufacturing_validated": false },
  "generation": { "seed": 71542, "generator_version": "0.1.0" }
}
