{
  "schema_version": "1.0",
  "id": "assist_heavy",
  "display_name": "Heavy Assist",
  "part_type": "assist_ring",
  "interface_id": "NSS-V1",
  "spin_direction": "right",
  "dimensions": {
    "outer_radius_mm": 31.0,
    "inner_radius_mm": 10.8,
    "height_mm": 3.4
  },
  "geometry": {
    "kind": "annular_ring",
    "segments": 72,
    "outer_radius_mm": 31.0,
    "inner_radius_mm": 10.8,
    "height_mm": 3.4,
    "node_count": 6,
    "roundness": 0.9,
    "phase_deg": 0.0
  },
  "mounts": {
    "top": {
      "position_mm": [0.0, 0.0, 1.7],
      "rotation_deg": [0.0, 0.0, 0.0],
      "datum_radius_mm": 10.8,
      "interface_role": "female",
      "orientation_key_deg": 0.0
    },
    "bottom": {
      "position_mm": [0.0, 0.0, -1.7],
      "rotation_deg": [0.0, 0.0, 0.0],
      "datum_radius_mm": 10.8,
      "interface_role": "male",
      "orientation_key_deg": 0.0
    }
  },
  "material_slots": ["brushed_silver", "obsidian_polymer"],
  "originality_rules": {
    "no_existing_logo": true,
    "no_existing_name": true,
    "no_reference_outline_tracing": true,
    "no_existing_interface_copy": true,
    "minimum_primary_dimensions_changed": 3
  },
  "engineering_status": {
    "status": "concept_only",
    "mass_properties_validated": false,
    "manufacturing_validated": false
  },
  "generation": {
    "seed": 62031,
    "generator_version": "0.1.0"
  }
}
