{
  "schema_version": "1.0",
  "id": "tip_flat_attack",
  "display_name": "Flat Attack Tip",
  "part_type": "performance_tip",
  "interface_id": "NSS-V1",
  "spin_direction": "right",
  "dimensions": {
    "outer_radius_mm": 8.0,
    "height_mm": 8.0
  },
  "geometry": {
    "kind": "revolved_tip",
    "segments": 48,
    "outer_radius_mm": 8.0,
    "height_mm": 8.0,
    "contact_profile": "flat",
    "profile_points_mm": [
      [2.8, -6.5],
      [3.4, -5.8],
      [5.6, -3.2],
      [8.0, -1.2],
      [8.0, -0.65]
    ]
  },
  "mounts": {
    "top": {
      "position_mm": [0.0, 0.0, 0.54],
      "rotation_deg": [0.0, 0.0, 0.0],
      "datum_radius_mm": 10.8,
      "interface_role": "female",
      "orientation_key_deg": 0.0
    },
    "bottom": {
      "position_mm": [0.0, 0.0, -6.5],
      "rotation_deg": [0.0, 0.0, 0.0],
      "datum_radius_mm": 2.8,
      "interface_role": "terminal",
      "orientation_key_deg": 0.0
    }
  },
  "material_slots": ["obsidian_polymer", "solar_amber"],
  "originality_rules": {
    "no_existing_logo": true,
    "no_existing_name": true,
    "no_reference_outline_tracing": true,
    "no_existing_interface_copy": true,
    "minimum_primary_dimensions_changed": 3
  },
  "engineering_status": {
    "status": "concept_only",
    "mass_properties_validated": false,
    "manufacturing_validated": false
  },
  "generation": {
    "seed": 48008,
    "generator_version": "0.1.0"
  }
}
