{
  "schema_version": "1.0", "id": "gear_medium", "display_name": "Medium Height Gear",
  "part_type": "height_gear", "interface_id": "NSS-V1", "spin_direction": "right",
  "profile_family": "medium_chevron_rib",
  "dimensions": { "outer_radius_mm": 17.0, "inner_radius_mm": 10.8, "height_mm": 5.0 },
  "geometry": {
    "kind": "radial_gear", "segments": 72, "outer_radius_mm": 17.0,
    "inner_radius_mm": 10.8, "height_mm": 5.0, "chevron_count": 12,
    "waist_radius_mm": 15.2, "waist_height_mm": 1.2, "shoulder_z_mm": 1.8,
    "rib_depth_mm": 0.8, "roundness": 0.34, "phase_deg": 7.5
  },
  "mounts": {
    "top": { "position_mm": [0.0, 0.0, 2.5], "rotation_deg": [0.0, 0.0, 0.0], "datum_radius_mm": 10.8, "interface_role": "female", "orientation_key_deg": 0.0 },
    "bottom": { "position_mm": [0.0, 0.0, -2.5], "rotation_deg": [0.0, 0.0, 0.0], "datum_radius_mm": 10.8, "interface_role": "male", "orientation_key_deg": 0.0 }
  },
  "material_slots": ["obsidian_polymer", "solar_amber"],
  "originality_rules": { "no_existing_logo": true, "no_existing_name": true, "no_reference_outline_tracing": true, "no_existing_interface_copy": true, "minimum_primary_dimensions_changed": 4 },
  "engineering_status": { "status": "concept_only", "mass_properties_validated": false, "manufacturing_validated": false },
  "generation": { "seed": 71541, "generator_version": "0.1.0" }
}
