{
  "schema_version": "1.0",
  "id": "blade_iron_bastion",
  "display_name": "Iron Bastion",
  "part_type": "main_blade",
  "interface_id": "NSS-V1",
  "spin_direction": "right",
  "profile_family": "iron_bastion_damper",
  "dimensions": {
    "outer_radius_mm": 35.0,
    "inner_radius_mm": 10.8,
    "height_mm": 4.8
  },
  "geometry": {
    "kind": "radial_blade",
    "segments": 96,
    "blade_count": 8,
    "base_radius_mm": 32.0,
    "outer_radius_mm": 35.0,
    "inner_radius_mm": 10.8,
    "height_mm": 4.8,
    "contact_profile": "rounded_damper",
    "damper_count": 8,
    "radial_amplitude_mm": 1.4,
    "damper_width_deg": 34.0,
    "inner_weight_radius_mm": 25.0,
    "inner_band_width_mm": 6.0,
    "roundness": 0.88,
    "phase_deg": 0.0
  },
  "mounts": {
    "top": {
      "position_mm": [0.0, 0.0, 3.5],
      "rotation_deg": [0.0, 0.0, 0.0],
      "datum_radius_mm": 10.8,
      "interface_role": "female",
      "orientation_key_deg": 0.0
    },
    "bottom": {
      "position_mm": [0.0, 0.0, -2.4],
      "rotation_deg": [0.0, 0.0, 0.0],
      "datum_radius_mm": 10.8,
      "interface_role": "male",
      "orientation_key_deg": 0.0
    }
  },
  "material_slots": ["brushed_silver", "obsidian_polymer", "solar_amber"],
  "originality_rules": {
    "no_existing_logo": true,
    "no_existing_name": true,
    "no_reference_outline_tracing": true,
    "no_existing_interface_copy": true,
    "minimum_primary_dimensions_changed": 3
  },
  "engineering_status": {
    "status": "concept_only",
    "mass_properties_validated": false,
    "manufacturing_validated": false
  },
  "generation": {
    "seed": 82031,
    "generator_version": "0.1.0"
  }
}
