{
  "schema_version": "1.0", "id": "tip_ball_defense", "display_name": "Ball Defense Tip",
  "part_type": "performance_tip", "interface_id": "NSS-V1", "spin_direction": "right",
  "dimensions": { "outer_radius_mm": 8.0, "height_mm": 8.2 },
  "geometry": {
    "kind": "revolved_tip", "segments": 64, "outer_radius_mm": 8.0, "height_mm": 8.2,
    "contact_profile": "ball", "contact_radius_mm": 3.2,
    "profile_points_mm": [[3.2, -7.66], [4.4, -7.1], [5.8, -5.8], [7.4, -3.0], [8.0, -1.2], [8.0, -0.65]]
  },
  "mounts": {
    "top": { "position_mm": [0.0, 0.0, 0.54], "rotation_deg": [0.0, 0.0, 0.0], "datum_radius_mm": 10.8, "interface_role": "female", "orientation_key_deg": 0.0 },
    "bottom": { "position_mm": [0.0, 0.0, -7.66], "rotation_deg": [0.0, 0.0, 0.0], "datum_radius_mm": 3.2, "interface_role": "terminal", "orientation_key_deg": 0.0 }
  },
  "material_slots": ["obsidian_polymer", "brushed_silver"],
  "originality_rules": { "no_existing_logo": true, "no_existing_name": true, "no_reference_outline_tracing": true, "no_existing_interface_copy": true, "minimum_primary_dimensions_changed": 4 },
  "engineering_status": { "status": "concept_only", "mass_properties_validated": false, "manufacturing_validated": false },
  "generation": { "seed": 71551, "generator_version": "0.1.0" }
}
