{
  "schema_version": "1.0",
  "id": "blade_orbit_halo",
  "display_name": "Orbit Halo",
  "part_type": "main_blade",
  "interface_id": "NSS-V1",
  "spin_direction": "right",
  "profile_family": "orbit_halo_streamline",
  "dimensions": {
    "outer_radius_mm": 35.5,
    "inner_radius_mm": 10.8,
    "height_mm": 4.2
  },
  "geometry": {
    "kind": "radial_blade",
    "segments": 96,
    "blade_count": 4,
    "base_radius_mm": 31.5,
    "outer_radius_mm": 35.5,
    "inner_radius_mm": 10.8,
    "height_mm": 4.2,
    "contact_profile": "low_drag",
    "window_count": 4,
    "window_inner_radius_mm": 17.0,
    "window_outer_radius_mm": 27.5,
    "window_width_deg": 38.0,
    "spoke_count": 4,
    "spoke_width_mm": 3.0,
    "streamline_sweep_deg": 12.0,
    "phase_deg": 0.0
  },
  "mounts": {
    "top": {
      "position_mm": [0.0, 0.0, 3.2],
      "rotation_deg": [0.0, 0.0, 0.0],
      "datum_radius_mm": 10.8,
      "interface_role": "female",
      "orientation_key_deg": 0.0
    },
    "bottom": {
      "position_mm": [0.0, 0.0, -2.4],
      "rotation_deg": [0.0, 0.0, 0.0],
      "datum_radius_mm": 10.8,
      "interface_role": "male",
      "orientation_key_deg": 0.0
    }
  },
  "material_slots": ["brushed_silver", "cobalt_blue_translucent", "obsidian_polymer"],
  "originality_rules": {
    "no_existing_logo": true,
    "no_existing_name": true,
    "no_reference_outline_tracing": true,
    "no_existing_interface_copy": true,
    "minimum_primary_dimensions_changed": 3
  },
  "engineering_status": {
    "status": "concept_only",
    "mass_properties_validated": false,
    "manufacturing_validated": false
  },
  "generation": {
    "seed": 44107,
    "generator_version": "0.1.0"
  }
}
